Bus 004 Device 003: ID 046d:c24d Logitech, Inc. 
Device Descriptor:
  bLength                18
  bDescriptorType         1
  bcdUSB               2.00
  bDeviceClass            0 (Defined at Interface level)
  bDeviceSubClass         0 
  bDeviceProtocol         0 
  bMaxPacketSize0        32
  idVendor           0x046d Logitech, Inc.
  idProduct          0xc24d 
  bcdDevice           80.01
  iManufacturer           1 Logitech
  iProduct                2 Logitech G710 Keyboard
  iSerial                 0 
  bNumConfigurations      1
  Configuration Descriptor:
    bLength                 9
    bDescriptorType         2
    wTotalLength           59
    bNumInterfaces          2
    bConfigurationValue     1
    iConfiguration          4 U80.01_B0012
    bmAttributes         0xa0
      (Bus Powered)
      Remote Wakeup
    MaxPower              400mA
    Interface Descriptor:
      bLength                 9
      bDescriptorType         4
      bInterfaceNumber        0
      bAlternateSetting       0
      bNumEndpoints           1
      bInterfaceClass         3 Human Interface Device
      bInterfaceSubClass      1 Boot Interface Subclass
      bInterfaceProtocol      1 Keyboard
      iInterface              0 
        HID Device Descriptor:
          bLength                 9
          bDescriptorType        33
          bcdHID               1.11
          bCountryCode            0 Not supported
          bNumDescriptors         1
          bDescriptorType        34 Report
          wDescriptorLength      65
          Report Descriptor: (length is 65)
            Item(Global): Usage Page, data= [ 0x01 ] 1
                            Generic Desktop Controls
            Item(Local ): Usage, data= [ 0x06 ] 6
                            Keyboard
            Item(Main  ): Collection, data= [ 0x01 ] 1
                            Application
            Item(Global): Usage Page, data= [ 0x07 ] 7
                            Keyboard
            Item(Local ): Usage Minimum, data= [ 0xe0 ] 224
                            Control Left
            Item(Local ): Usage Maximum, data= [ 0xe7 ] 231
                            GUI Right
            Item(Global): Logical Minimum, data= [ 0x00 ] 0
            Item(Global): Logical Maximum, data= [ 0x01 ] 1
            Item(Global): Report Size, data= [ 0x01 ] 1
            Item(Global): Report Count, data= [ 0x08 ] 8
            Item(Main  ): Input, data= [ 0x02 ] 2
                            Data Variable Absolute No_Wrap Linear
                            Preferred_State No_Null_Position Non_Volatile Bitfield
            Item(Global): Report Count, data= [ 0x01 ] 1
            Item(Global): Report Size, data= [ 0x08 ] 8
            Item(Main  ): Input, data= [ 0x01 ] 1
                            Constant Array Absolute No_Wrap Linear
                            Preferred_State No_Null_Position Non_Volatile Bitfield
            Item(Global): Report Count, data= [ 0x03 ] 3
            Item(Global): Report Size, data= [ 0x01 ] 1
            Item(Global): Usage Page, data= [ 0x08 ] 8
                            LEDs
            Item(Local ): Usage Minimum, data= [ 0x01 ] 1
                            NumLock
            Item(Local ): Usage Maximum, data= [ 0x03 ] 3
                            Scroll Lock
            Item(Main  ): Output, data= [ 0x02 ] 2
                            Data Variable Absolute No_Wrap Linear
                            Preferred_State No_Null_Position Non_Volatile Bitfield
            Item(Global): Report Count, data= [ 0x05 ] 5
            Item(Global): Report Size, data= [ 0x01 ] 1
            Item(Main  ): Output, data= [ 0x01 ] 1
                            Constant Array Absolute No_Wrap Linear
                            Preferred_State No_Null_Position Non_Volatile Bitfield
            Item(Global): Report Count, data= [ 0x06 ] 6
            Item(Global): Report Size, data= [ 0x08 ] 8
            Item(Global): Logical Minimum, data= [ 0x00 ] 0
            Item(Global): Logical Maximum, data= [ 0xff 0x00 ] 255
            Item(Global): Usage Page, data= [ 0x07 ] 7
                            Keyboard
            Item(Local ): Usage Minimum, data= [ 0x00 ] 0
                            No Event
            Item(Local ): Usage Maximum, data= [ 0xff 0x00 ] 255
                            (null)
            Item(Main  ): Input, data= [ 0x00 ] 0
                            Data Array Absolute No_Wrap Linear
                            Preferred_State No_Null_Position Non_Volatile Bitfield
            Item(Main  ): End Collection, data=none
      Endpoint Descriptor:
        bLength                 7
        bDescriptorType         5
        bEndpointAddress     0x81  EP 1 IN
        bmAttributes            3
          Transfer Type            Interrupt
          Synch Type               None
          Usage Type               Data
        wMaxPacketSize     0x0008  1x 8 bytes
        bInterval               2
    Interface Descriptor:
      bLength                 9
      bDescriptorType         4
      bInterfaceNumber        1
      bAlternateSetting       0
      bNumEndpoints           1
      bInterfaceClass         3 Human Interface Device
      bInterfaceSubClass      0 No Subclass
      bInterfaceProtocol      0 None
      iInterface              0 
        HID Device Descriptor:
          bLength                 9
          bDescriptorType        33
          bcdHID               1.11
          bCountryCode            0 Not supported
          bNumDescriptors         1
          bDescriptorType        34 Report
          wDescriptorLength     149
          Report Descriptor: (length is 149)
            Item(Global): Usage Page, data= [ 0x01 ] 1
                            Generic Desktop Controls
            Item(Local ): Usage, data= [ 0x06 ] 6
                            Keyboard
            Item(Main  ): Collection, data= [ 0x01 ] 1
                            Application
            Item(Global): Usage Page, data= [ 0x07 ] 7
                            Keyboard
            Item(Local ): Usage Minimum, data= [ 0x00 ] 0
                            No Event
            Item(Local ): Usage Maximum, data= [ 0xe7 ] 231
                            GUI Right
            Item(Global): Logical Minimum, data= [ 0x00 ] 0
            Item(Global): Logical Maximum, data= [ 0xe7 0x00 ] 231
            Item(Global): Report Size, data= [ 0x08 ] 8
            Item(Global): Report Count, data= [ 0x14 ] 20
            Item(Global): Report ID, data= [ 0x01 ] 1
            Item(Main  ): Input, data= [ 0x00 ] 0
                            Data Array Absolute No_Wrap Linear
                            Preferred_State No_Null_Position Non_Volatile Bitfield
            Item(Main  ): End Collection, data=none
            Item(Global): Usage Page, data= [ 0x0c ] 12
                            Consumer
            Item(Local ): Usage, data= [ 0x01 ] 1
                            Consumer Control
            Item(Main  ): Collection, data= [ 0x01 ] 1
                            Application
            Item(Global): Report ID, data= [ 0x02 ] 2
            Item(Global): Logical Minimum, data= [ 0x00 ] 0
            Item(Global): Logical Maximum, data= [ 0x01 ] 1
            Item(Global): Report Size, data= [ 0x01 ] 1
            Item(Global): Report Count, data= [ 0x07 ] 7
            Item(Local ): Usage, data= [ 0xb5 ] 181
                            Scan Next Track
            Item(Local ): Usage, data= [ 0xb6 ] 182
                            Scan Previous Track
            Item(Local ): Usage, data= [ 0xb7 ] 183
                            Stop
            Item(Local ): Usage, data= [ 0xcd ] 205
                            Play/Pause
            Item(Local ): Usage, data= [ 0xe9 ] 233
                            Volume Increment
            Item(Local ): Usage, data= [ 0xea ] 234
                            Volume Decrement
            Item(Local ): Usage, data= [ 0xe2 ] 226
                            Mute
            Item(Main  ): Input, data= [ 0x02 ] 2
                            Data Variable Absolute No_Wrap Linear
                            Preferred_State No_Null_Position Non_Volatile Bitfield
            Item(Global): Report Count, data= [ 0x01 ] 1
            Item(Main  ): Input, data= [ 0x01 ] 1
                            Constant Array Absolute No_Wrap Linear
                            Preferred_State No_Null_Position Non_Volatile Bitfield
            Item(Main  ): End Collection, data=none
            Item(Global): Usage Page, data= [ 0x00 0xff ] 65280
                            (null)
            Item(Local ): Usage, data= [ 0x00 ] 0
                            (null)
            Item(Main  ): Collection, data= [ 0x01 ] 1
                            Application
            Item(Global): Logical Minimum, data= [ 0x00 ] 0
            Item(Global): Logical Maximum, data= [ 0xff 0x00 ] 255
            Item(Global): Report Size, data= [ 0x08 ] 8
            Item(Local ): Usage, data= [ 0x03 ] 3
                            (null)
            Item(Global): Report ID, data= [ 0x03 ] 3
            Item(Global): Report Count, data= [ 0x03 ] 3
            Item(Main  ): Input, data= [ 0x02 ] 2
                            Data Variable Absolute No_Wrap Linear
                            Preferred_State No_Null_Position Non_Volatile Bitfield
            Item(Local ): Usage, data= [ 0x04 ] 4
                            (null)
            Item(Global): Report ID, data= [ 0x04 ] 4
            Item(Global): Report Count, data= [ 0x07 ] 7
            Item(Main  ): Input, data= [ 0x02 ] 2
                            Data Variable Absolute No_Wrap Linear
                            Preferred_State No_Null_Position Non_Volatile Bitfield
            Item(Local ): Usage, data= [ 0x05 ] 5
                            (null)
            Item(Global): Report ID, data= [ 0x05 ] 5
            Item(Global): Logical Minimum, data= [ 0x00 ] 0
            Item(Global): Logical Maximum, data= [ 0xff 0x00 ] 255
            Item(Global): Report Size, data= [ 0x08 ] 8
            Item(Global): Report Count, data= [ 0x07 ] 7
            Item(Main  ): Feature, data= [ 0x02 ] 2
                            Data Variable Absolute No_Wrap Linear
                            Preferred_State No_Null_Position Non_Volatile Bitfield
            Item(Local ): Usage, data= [ 0x06 ] 6
                            (null)
            Item(Global): Report ID, data= [ 0x06 ] 6
            Item(Global): Report Count, data= [ 0x01 ] 1
            Item(Main  ): Feature, data= [ 0x02 ] 2
                            Data Variable Absolute No_Wrap Linear
                            Preferred_State No_Null_Position Non_Volatile Bitfield
            Item(Local ): Usage, data= [ 0x07 ] 7
                            (null)
            Item(Global): Report ID, data= [ 0x07 ] 7
            Item(Global): Report Count, data= [ 0x04 ] 4
            Item(Main  ): Feature, data= [ 0x02 ] 2
                            Data Variable Absolute No_Wrap Linear
                            Preferred_State No_Null_Position Non_Volatile Bitfield
            Item(Local ): Usage, data= [ 0x08 ] 8
                            (null)
            Item(Global): Report ID, data= [ 0x08 ] 8
            Item(Global): Report Count, data= [ 0x03 ] 3
            Item(Main  ): Feature, data= [ 0x02 ] 2
                            Data Variable Absolute No_Wrap Linear
                            Preferred_State No_Null_Position Non_Volatile Bitfield
            Item(Local ): Usage, data= [ 0x09 ] 9
                            (null)
            Item(Global): Report ID, data= [ 0x09 ] 9
            Item(Global): Report Count, data= [ 0x0c ] 12
            Item(Main  ): Feature, data= [ 0x02 ] 2
                            Data Variable Absolute No_Wrap Linear
                            Preferred_State No_Null_Position Non_Volatile Bitfield
            Item(Local ): Usage, data= [ 0x80 ] 128
                            (null)
            Item(Global): Report ID, data= [ 0x80 ] 128
            Item(Global): Report Count, data= [ 0x07 ] 7
            Item(Main  ): Feature, data= [ 0x02 ] 2
                            Data Variable Absolute No_Wrap Linear
                            Preferred_State No_Null_Position Non_Volatile Bitfield
            Item(Main  ): End Collection, data=none
      Endpoint Descriptor:
        bLength                 7
        bDescriptorType         5
        bEndpointAddress     0x82  EP 2 IN
        bmAttributes            3
          Transfer Type            Interrupt
          Synch Type               None
          Usage Type               Data
        wMaxPacketSize     0x0020  1x 32 bytes
        bInterval               2
Device Status:     0x0000
  (Bus Powered)